Same/Different,API Name,API Party,API Place,Contest Type,API Candidate Code,Mz Legal Name,Mz Other Names,Mz Candidate Code,Mz URL,Mz Parties Ever,Mz Aspirant Ever,Mz Politician Ever,Mz ID
Same,BENSON ITWIKU MBAI,FORD-PEOPLE,MASINGA (constituency),,C662D082-F366-E211-A3B9-00505687000D,Benson Itwiku Mbai,Benson Itwiku Mbai,,http://info.mzalendo.com/person/benson-mbai/,"Ford People, Orange Democratic Movement Party Of Kenya",Aspirant MP at Masinga  (Constituency 2013-),Member of Parliament at Masinga (Constituency 2007-2013),181
Same,CLEMENT MUCHIRI WAMBUGU,THE NATIONAL ALLIANCE,MATHIOYA (constituency),,B27D3677-9F67-E211-8158-00505687000D,Clement Muchiri Wambugu,Clement Muchiri Wambugu,,http://info.mzalendo.com/person/clement-wambugu/,"Party of National Unity, The National Alliance (TNA)",Aspirant MP at Mathioya (Constituency 2013-),Member of Parliament at Mathioya (Constituency 2007-2013),149
Same (post vying for missing),DAVID AOKO WERE,NEW FORD KENYA,MATUNGU (constituency),,FF8609F5-736C-E211-A5C8-005056870012,David Aoko Were,David Aoko Were,,http://info.mzalendo.com/person/david-were/,Orange Democratic Movement,,Member of Parliament at Matungu (Constituency 2007-2013),153
Same (post vying for missing),MOFFAT MUIA MAITHA,NATIONAL RAINBOW COALITION,MATUNGULU (constituency),,4BFC947D-0767-E211-A3B9-00505687000D,Moffat Muia Maitha,Moffat Muia Maitha,,http://info.mzalendo.com/person/moffat-maitha/,Sisi Kwa Sisi,,Representative at None,370
Same (post vying for missing),JUSTIN BEDAN NJOKA MUTURI,THE NATIONAL ALLIANCE,MBEERE NORTH (constituency),,1F38EDD7-9B67-E211-8158-00505687000D,Justin Bedan Njoka Muturi,Justin Bedan Njoka Muturi,,http://info.mzalendo.com/person/justin-muturi/,Kenya African National Union,,,215
Same (post vying for missing),MUTAVA MUSYIMI,THE NATIONAL ALLIANCE,MBEERE SOUTH (constituency),,F65CE7D1-9B67-E211-8158-00505687000D,Mutava Musyimi,Mutava Musyimi,,http://info.mzalendo.com/person/mutava-musyimi/,"Party of National Unity, The National Alliance (TNA)","Aspirant MP at Mbeere South (Constituency 2013-), Aspirant President at Kenya (Country)",Member of Parliament at Gachoka (Constituency 2007-2013),95
Same,MILLIE GRACE AKOTH ODHIAMBO,ORANGE DEMOCRATIC MOVEMENT,MBITA (constituency),,9A068058-A16C-E211-A5C8-005056870012,Millie Grace Akoth Odhiambo,Millie Grace Akoth Odhiambo,,http://info.mzalendo.com/person/millie-odhiambo/,Orange Democratic Movement,Aspirant MP at Mbita (Constituency 2013-),Nominated Member of Parliament at None,376
Same,JOSEPH KONZOLLO MUNYAO,DEMOCRATIC PARTY OF KENYA,MBOONI (constituency),,8D60075C-C866-E211-A3B9-00505687000D,Joseph Konzolo Munyao,,,http://info.mzalendo.com/person/joseph-munyao/,"Kenya African National Union, Kenya African National Union, National Rainbow Coalition",Aspirant MP at Mbooni (Constituency 2013-),,279
Same,HELLEN JEPKEMOI SAMBILI,KENYA AFRICAN NATIONAL UNION,MOGOTIO (constituency),,634A24AF-DB66-E211-A3B9-00505687000D,Hellen Jepkemoi Sambili,Hellen Jepkemoi Sambili,,http://info.mzalendo.com/person/hellen-sambili/,"Kenya African National Union, United Democratic Movement",Aspirant MP at Mogotio (Constituency 2013-),Member of Parliament at Mogotio (Constituency 2007-2013),28
Same (Post vying for not listed),JOSEPH KIPKAPTO KORIR,THE NATIONAL VISION PARTY,MOGOTIO (constituency),,9E3309EF-706C-E211-A5C8-005056870012,Joseph Kipkaptor Korir,,,http://info.mzalendo.com/person/joseph-korir/,Kenya African National Union,,,333
Same,DAVID KOECH,KENYA NATIONAL CONGRESS,MOSOP (constituency),,E50A1FE8-8569-E211-B91E-005056870012,David Kibet Koech,,,http://info.mzalendo.com/person/david-koech/,Orange Democratic Movement,,Member of Parliament at Mosop (Constituency 2007-2013),56
Same (post vying for missing),JOHN KIPKORIR SAMBU,UNITED DEMOCRATIC MOVEMENT,MOSOP (constituency),,524B6ADB-F36A-E211-A5C8-005056870012,John Kipkorir Sambu,John Kipkorir Sambu,,http://info.mzalendo.com/person/john-sambu/,Kenya African National Union,,,335
Same (Post vying for not listed),JOHN BOMETT SERUT,,MT. ELGON (constituency),,FC3E052D-F16B-E211-A5C8-005056870012,John Bomet Serut,,,http://info.mzalendo.com/person/john-serut/,Kenya African National Union,,,297
Same,PATRICK AYIECHO OLWENY,ORANGE DEMOCRATIC MOVEMENT,MUHORONI (constituency),,F7D27588-7D6B-E211-A5C8-005056870012,Patrick Ayiecho Olweny,Patrick Ayiecho Olweny,,http://info.mzalendo.com/person/Patrick-olweny/,"National Rainbow Coalition, Orange Democratic Movement",Aspirant MP at Muhoroni (Constituency 2013-),Member of Parliament at Muhoroni (Constituency 2007-2013),122
Same,KABANDO WA KABANDO,THE NATIONAL ALLIANCE,MUKURWEINI (constituency),,977D3677-9F67-E211-8158-00505687000D,Kabando wa Kabando,Kabando wa Kabando,,http://info.mzalendo.com/person/kabando-kabando/,"Safina Party Of Kenya, The National Alliance (TNA)",Aspirant MP at Mukurweini (Constituency 2013-),Member of Parliament at Mukurweini (Constituency 2007-2013),31
Same (Post vying for not listed),DICKSON  MWANGI WATHIKA,MAZINGIRA GREENS PARTY OF KENYA,MUKURWEINI (constituency),,72727624-C866-E211-A3B9-00505687000D,Dickson Wathika Mwangi,,,http://info.mzalendo.com/person/dickson-wathika/,Party of National Unity,,,152
Same (post vying for missing),BENJAMIN JOMO WASHIALI,UNITED DEMOCRATIC FORUM PARTY,MUMIAS EAST (constituency),,016B021F-896C-E211-A5C8-005056870012,Benjamin Jomo Washiali,Benjamin Jomo Washiali,,http://info.mzalendo.com/person/benjamin-washiali/,Orange Democratic Movement,,Member of Parliament at Mumias (Constituency 2007-2013),151
Same (post vying for missing),DANIEL MUTUA MUOKI,WIPER DEMOCRATIC MOVEMENT- KENYA,MWALA (constituency),,29474986-956B-E211-A5C8-005056870012,Daniel Mutua Muoki,Daniel Mutua Muoki,,http://info.mzalendo.com/person/daniel-muoki/,Orange Democratic Movement Party Of Kenya,,Member of Parliament at Mwala (Constituency 2007-2013),88
Same (post vying for missing),PETER NJUGUNA GITAU,THE NATIONAL ALLIANCE,MWEA (constituency),,53838050-9F67-E211-8158-00505687000D,Peter Njuguna Gitau,Peter Njuguna Gitau,,http://info.mzalendo.com/person/peter-gitau/,Party of National Unity,,Member of Parliament at Mwea (Constituency 2007-2013),20
Same (post vying for missing),JOHN MICHAEL NJENGA MUTUTHO,NATIONAL RAINBOW COALITION,NAIVASHA (constituency),,CCB381E5-996C-E211-A5C8-005056870012,John Michael Njenga Mututho,John Michael Njenga Mututho,,http://info.mzalendo.com/person/john-mututho/,"Kenya African National Union, National Rainbow Coalition",,Member of Parliament at Naivasha (Constituency 2007-2013),97
Same,RICHARD MOITALEL OLE KENTA,THE NATIONAL ALLIANCE,NAROK NORTH (constituency),,D876FE0D-9C67-E211-8158-00505687000D,Richard Moitalel ole Kenta,Richard Moitalel ole Kenta,,http://info.mzalendo.com/person/richard-moitalel-ole-kenta/,,Aspirant Governor at Narok (County 2013-),,420
Same,WILLIAM RONGORA OLE NTIMAMA,ORANGE DEMOCRATIC MOVEMENT,NAROK NORTH (constituency),,EAB1335D-736B-E211-A5C8-005056870012,William Ronkorua ole Ntimama,William Ronkorua ole Ntimama,,http://info.mzalendo.com/person/william-ntimama/,"Kenya African National Union, National Rainbow Coalition, Orange Democratic Movement",Aspirant MP at Narok North (Constituency 2013-),Member of Parliament at Narok North (Constituency 2007-2013),200
Same,FRANCIS CHACHU GANYA,ORANGE DEMOCRATIC MOVEMENT,NORTH HORR (constituency),,7DA61CBD-486C-E211-A5C8-005056870012,Francis Chachu Ganya,Francis Chachu Ganya,,http://info.mzalendo.com/person/francis-ganya/,Orange Democratic Movement,Aspirant MP at North Horr (Constituency 2013-),Member of Parliament at North Horr (Constituency 2007-2013),18
Same (post vying for missing),SILAS MURIUKI RUTEERE,THE NATIONAL ALLIANCE,NORTH IMENTI (constituency),,57D8A1FB-A067-E211-8158-00505687000D,Silas Muriuki Ruteere,Silas Muriuki Ruteere,,http://info.mzalendo.com/person/silas-ruteere/,Mazingira  Greens Party of Kenya,,Member of Parliament at North Imenti (Constituency 2007-2013),92
Same (post vying for missing),POLLYINS OCHIENG ANYANGO,WIPER DEMOCRATIC MOVEMENT- KENYA,NYAKACH (constituency),,5166141B-0269-E211-9497-005056870012,Pollyins Ochieng Anyango,Pollyins Ochieng Anyango,,http://info.mzalendo.com/person/pollyins-anyango/,Orange Democratic Movement,,Member of Parliament at Nyakach (Constituency 2007-2013),7
Same (post vying for missing),FREDRICK OTIENO OUTA,ORANGE DEMOCRATIC MOVEMENT,NYANDO (constituency),,9B7FF096-486C-E211-A5C8-005056870012,Fredrick Otieno Outa,Fredrick Otieno Outa,,http://info.mzalendo.com/person/fredrick-outa/,Orange Democratic Movement,,Member of Parliament at Nyando (Constituency 2007-2013),133
Same (post vying for missing),ROBERT ONSARE MONDA,NATIONAL RAINBOW COALITION,NYARIBARI CHACHE (constituency),,9D8AD2A9-166D-E211-A5C8-005056870012,Robert Onsare Monda,Robert Onsare Monda,,http://info.mzalendo.com/person/robert-monda/,National Rainbow Coalition,,Member of Parliament at Nyaribari Chache (Constituency 2007-2013),83
Same,PETER EDICK OMONDI ANYANGA,ORANGE DEMOCRATIC MOVEMENT,NYATIKE (constituency),,04463E99-ED6C-E211-A5C8-005056870012,Peter Edick Omondi Anyanga,Peter Edick Omondi Anyanga,,http://info.mzalendo.com/person/Peter-anyanga/,Orange Democratic Movement,Aspirant MP at Nyatike (Constituency 2013-),Member of Parliament at Nyatike (Constituency 2007-2013),6
Same (post vying for missing),ERASTUS KIHARA MUREITHI,AGANO PARTY,OL JOROK (constituency),,EE6F1A7E-C466-E211-A3B9-00505687000D,Erastus Kihara Mureithi,Erastus Kihara Mureithi,,http://info.mzalendo.com/person/erastus-mureithi/,NARC - Kenya,,Member of Parliament at Ol Kalou (Constituency 2007-2013),89
Same (post vying for missing),LUKA KIPKORIR KIGEN,UNITED REPUBLICAN PARTY,RONGAI (constituency),,63F58BF4-3569-E211-9497-005056870012,Luka Kipkorir Kigen,Luka Kipkorir Kigen,,http://info.mzalendo.com/person/luka-kigen/,Orange Democratic Movement,,Member of Parliament at Rongai (Constituency 2007-2013),44
Same,CECILY MUTITU MBARIRE,THE NATIONAL ALLIANCE,RUNYENJES (constituency),,1B38EDD7-9B67-E211-8158-00505687000D,Cecily Mutitu Mbarire,Cecily Mutitu Mbarire,,http://info.mzalendo.com/person/cecily-mbarire/,"Party of National Unity, The National Alliance (TNA)",Aspirant MP at Runyenjes (Constituency 2013-),Member of Parliament at Runyenjes (Constituency 2007-2013),78
Same,HUSSEIN TARRY SASURA,THE NATIONAL ALLIANCE,SAKU (constituency),,64E69B11-7C69-E211-B91E-005056870012,Hussein Tarry Sasura,Hussein Tarry Sasura,,http://info.mzalendo.com/person/hussein-sasura/,"Orange Democratic Movement Party Of Kenya, The National Alliance (TNA)",Aspirant MP at Saku (Constituency 2013-),Member of Parliament at Saku (Constituency 2007-2013),138
Same (post vying for missing),RAPHAEL LAKALEI LETIMALO,THE NATIONAL ALLIANCE,SAMBURU EAST (constituency),,F330257B-7C69-E211-B91E-005056870012,Raphael Lakalei Letimalo,Raphael Lakalei Letimalo,,http://info.mzalendo.com/person/raphael-letimalo/,Orange Democratic Movement,,Member of Parliament at Samburu East (Constituency 2007-2013),68
Same,JAMES WAMBURA NYIKAL,ORANGE DEMOCRATIC MOVEMENT,SEME (constituency),,34F183A8-6D6B-E211-A5C8-005056870012,James Nyikal,James Nyikal,,http://info.mzalendo.com/person/james-nyikal/,Orange Democratic Movement,Aspirant MP at Seme (Constituency 2013-),,434
Same,WILSON MWOTINY LITOLE,ORANGE DEMOCRATIC MOVEMENT,SIGOR (constituency),,8DA61CBD-486C-E211-A5C8-005056870012,Wilson Mwotiny Litole,,,http://info.mzalendo.com/person/wilson-litole/,Orange Democratic Movement,Aspirant MP at Sigor (Constituency 2013-),Member of Parliament at Sigor (Constituency 2007-2013),70
Same,FRANCIS ARAP KIPYEGON SIGEI,KENYA AFRICAN NATIONAL UNION,SOTIK (constituency),,714A24AF-DB66-E211-A3B9-00505687000D,Francis Sigei,Francis Sigei,,http://info.mzalendo.com/person/francis-sigei/,,Aspirant Governor at Bomet (County 2013-),,426
Same,MANSON OYONGO NYAMWEYA,ORANGE DEMOCRATIC MOVEMENT,SOUTH MUGIRANGO (constituency),,DCA49B36-916B-E211-A5C8-005056870012,Manson Oyongo Nyamweya,Manson Oyongo Nyamweya,,http://info.mzalendo.com/person/manson-nyamweya/,"Ford People, Orange Democratic Movement",Aspirant MP at South Mugirango (Constituency 2013-),Member of Parliament at South Mugirango (Constituency 2007-2013),391
Same,NAOMI NAMSI SHABAN,THE NATIONAL ALLIANCE,TAVETA (constituency),,CAAB7856-9F67-E211-8158-00505687000D,Naomi Namisi Shaban,Naomi Namisi Shaban,,http://info.mzalendo.com/person/naomi-shaban/,"Kenya African National Union, The National Alliance (TNA)",Aspirant MP at Taveta (Constituency 2013-),Member of Parliament at Taveta (Constituency 2007-2013),139
Same,ALEX MUTHENGI MBURI MWIRU,UNITED REPUBLICAN PARTY,THARAKA (constituency),,C750BC2D-3669-E211-9497-005056870012,Alex Muthengi Mburi Mwiru,Alex Muthengi Mburi Mwiru,,http://info.mzalendo.com/person/alex-mwiru/,"Party of National Unity, United Republican Party (URP)",Aspirant MP at Tharaka (Constituency 2013-),Member of Parliament at Tharaka (Constituency 2007-2013),107
Different,DAVID NJEHIAH NGUGI,GRAND NATIONAL UNION,THIKA TOWN (constituency),,26F3A76B-BB66-E211-A3B9-00505687000D,David Mwaniki Ngugi,,,http://info.mzalendo.com/person/david-ngugi/,"Grand National Union, Sisi Kwa Sisi",Aspirant Governor at Nyandarua (County 2013-),Member of Parliament at Kinangop (Constituency 2007-2013),112
Same,DAVID ESELI SIMIYU,FORUM FOR RESTORATION OF DEMOCRACY-KENYA,TONGAREN (constituency),,51E21315-0269-E211-9497-005056870012,David Eseli Simiyu,David Eseli Simiyu,,http://info.mzalendo.com/person/david-eseli/,Forum For The Restoration Of Democracy - Kenya,Aspirant MP at Tongaren (Constituency 2013-),Member of Parliament at Kimilili (Constituency 2007-2013),141
Same,CYPRIAN OJWANG' OMOLLO,FORUM FOR RESTORATION OF DEMOCRACY-KENYA,URIRI (constituency),,5E66141B-0269-E211-9497-005056870012,Cyprian Ojwang Omollo,,,http://info.mzalendo.com/person/cyprian-omollo/,Orange Democratic Movement,,Member of Parliament at Uriri (Constituency 2007-2013),121
Same (post vying for missing),YUSUF KIFUMA CHANZU,UNITED DEMOCRATIC FORUM PARTY,VIHIGA (constituency),,D3C47CE1-8E6B-E211-A5C8-005056870012,Yusuf Kifuma Chanzu,Yusuf Kifuma Chanzu,,http://info.mzalendo.com/person/yusuf-chanzu/,Orange Democratic Movement,,Member of Parliament at Vihiga (Constituency 2007-2013),11
Same,JAMES ONDICHO  GESAMI,ORANGE DEMOCRATIC MOVEMENT,WEST MUGIRANGO (constituency),,A17FF096-486C-E211-A5C8-005056870012,James Ondicho Gesami,James Gesami,,http://info.mzalendo.com/person/james-gesami/,Orange Democratic Movement,Aspirant MP at West Mugirango (Constituency 2013-),Member of Parliament at West Mugirango (Constituency 2007-2013),19
Same,THOMAS LUDINDI MWADEGHU,ORANGE DEMOCRATIC MOVEMENT,WUNDANYI (constituency),,F4A25A44-C86B-E211-A5C8-005056870012,Thomas Ludindi Mwadeghu,Thomas Ludindi Mwadeghu,,http://info.mzalendo.com/person/thomas-mwadeghu/,Orange Democratic Movement,"Aspirant MP at Wundanyi (Constituency 2013-), Aspirant MP at Wundanyi (Constituency 2013-)",Member of Parliament at Wundanyi (Constituency 2007-2013),98
Different,ABDI MOHAMED,DEMOCRATIC PARTY OF KENYA,BENANE (ward),,38090862-C866-E211-A3B9-00505687000D,Abdi Mohamud Mohamed,,,http://info.mzalendo.com/person/abdi-mohamed/,Kenya African National Union,,,261
Different,PETER WANYOIKE GITAU,THE NATIONAL ALLIANCE,DANDORA AREA I (ward),,6AB0331D-9C67-E211-8158-00505687000D,Peter Njuguna Gitau,,,http://info.mzalendo.com/person/peter-gitau/,Party of National Unity,,Member of Parliament at Mwea (Constituency 2007-2013),20
Different,DAVID  WAIGANJO NGUGI,MZALENDO SABA SABA PARTY,EASTLEIGH NORTH (ward),,3E96264F-7C6C-E211-A5C8-005056870012,David Mwaniki Ngugi,,,http://info.mzalendo.com/person/david-ngugi/,"Grand National Union, Sisi Kwa Sisi",Aspirant Governor at Nyandarua (County 2013-),Member of Parliament at Kinangop (Constituency 2007-2013),112
Different,MOHAMED IBRAHIM ALI,UNITED DEMOCRATIC FORUM PARTY,GITHER (ward),,5B42F957-4E6C-E211-A5C8-005056870012,Mohamed Hussein Ali,,,http://info.mzalendo.com/person/mohamed-ali/,Orange Democratic Movement,,Member of Parliament at Mandera East (Constituency 2007-2013),81
Different,DAVID KIPRONO KOECH,WIPER DEMOCRATIC MOVEMENT- KENYA,KIPSONOI (ward),,2C02607B-736B-E211-A5C8-005056870012,David Kibet Koech,,,http://info.mzalendo.com/person/david-koech/,Orange Democratic Movement,,Member of Parliament at Mosop (Constituency 2007-2013),56
Different,JOSEPH KASIWA MUNYAO,THE INDEPENDENT PARTY,KYELENI (ward),,C4AF14B1-B76B-E211-A5C8-005056870012,Joseph Konzolo Munyao,,,http://info.mzalendo.com/person/joseph-munyao/,"Kenya African National Union, Kenya African National Union, National Rainbow Coalition",Aspirant MP at Mbooni (Constituency 2013-),,279
Different (relative of the other),RASHID KIVYASO SHAKOMBO,,LIKONI (ward),,218E5E62-9567-E211-8158-00505687000D,Rashid Suleiman Shakombo,Rashid Suleiman Shakombo,,http://info.mzalendo.com/person/rashid-shakombo/,"National Rainbow Coalition, Shirikisho Party Of Kenya",Aspirant Senator at Mombasa (County 2013-),,244
Different,JOHN KANIARU KARIUKI,THE NATIONAL ALLIANCE,LIMURU EAST (ward),,3C998416-716B-E211-A5C8-005056870012,John Ngata Kariuki,,,http://info.mzalendo.com/person/john-kariuki/,Ford Asili,,,37
Same,DAVID K TOO,ORANGE DEMOCRATIC MOVEMENT,NGERIA (ward),,469BBEA9-486C-E211-A5C8-005056870012,David Kimutai Too,,,http://info.mzalendo.com/person/david-too/,Orange Democratic Movement,,,212
Different,HASSAN OMAR OMAR,UNITY PARTY OF KENYA,SHANZU (ward),,D79B98F5-6970-E211-A589-005056870012,Hassan Omar Hassan Sarai,Hassan Omar Hassan Sarai,,http://info.mzalendo.com/person/hassan-omar-hassan-sarai/,Wiper democratic Movement Kenya,Aspirant Senator at Mombasa (County 2013-),,431
Different,ABDI IBRAHIM MOHAMED,NATIONAL AGENDA PARTY OF KENYA,TOWNSHIP (ward),,01CF7240-D766-E211-A3B9-00505687000D,Abdi Mohamud Mohamed,,,http://info.mzalendo.com/person/abdi-mohamed/,Kenya African National Union,,,261
Different,JOSEPH KIPRUTO KORIR,UNITED DEMOCRATIC FORUM PARTY,ZIWA (ward),,4CD207FF-726C-E211-A5C8-005056870012,Joseph Kipkaptor Korir,,,http://info.mzalendo.com/person/joseph-korir/,Kenya African National Union,,,333
Same,MARGARET WANJIRU,ORANGE DEMOCRATIC MOVEMENT,Nairobi (county),,7D9CBEA9-486C-E211-A5C8-005056870012,Margaret Wanjiru Kariuki,Margaret Wanjiru,,http://info.mzalendo.com/person/margaret-wanjiru/,Orange Democratic Movement,Aspirant Senator at Nairobi (County 2013-),Member of Parliament at Starehe (Constituency 2007-2013),372
Same,JIMNAH MWANGI MBARU,ALLIANCE PARTY OF KENYA,Nairobi (county),,9500B5AE-C466-E211-A3B9-00505687000D,Jimnah Mbaru,,,http://info.mzalendo.com/person/jimnah-mbaru/,Alliance Party of Kenya (APK),Aspirant Governor at Nairobi (County 2013-),,429
Same,GACHEKE GACHIHI,SAFINA,Mathare (constituency),,23FC947D-0767-E211-A3B9-00505687000D,Gacheke Gachihi,,,http://info.mzalendo.com/person/gacheke-gachihi/,Safina Party Of Kenya,Aspirant MP at Mathare (Constituency 2013-),,464
Same,JOSEPH KIPNGETICH KIRUI,UNITED DEMOCRATIC FORUM PARTY,Kipkelion East (constituency),,B0349064-4E6C-E211-A5C8-005056870012,Joseph Kirui,,,http://info.mzalendo.com/person/joseph-kirui/,United Democratic Forum Party (UDF),Aspirant Ward Representative at Nyangores (Ward 2013-),,10475
Same,GILBERT KASYIMA KIVUNZYO,,Kitui West (constituency),,1190998D-AB6B-E211-A5C8-005056870012,Gilbert Kasyima Kivunzyo,,,http://info.mzalendo.com/person/gilbert-kasyima-kivunzyo/,,Aspirant MP at Kitui West (Constituency 2013-),,1982
Same,JACK HILLARY OJIAMBO,THE LABOUR PARTY OF KENYA,Dagoretti North (constituency),,84C3F6FC-1F6A-E211-B91E-005056870012,Jack Ojiambo,,,http://info.mzalendo.com/person/jack-ojiambo/,Labour Party Of Kenya,Aspirant MP at Dagoretti North (Constituency 2013-),,482
Same,JAMES MWANGI NGUGI,PARTY OF ACTION,Menengai (ward),,47756DB6-6D6C-E211-A5C8-005056870012,James Mwangi Ngugi,,,http://info.mzalendo.com/person/james-mwangi-ngugi/,Party of Action,Aspirant Ward Representative at Mbaruk / Eburu (Ward 2013-),,8808
Same,MOHAMED ABDULLAHI AHMED,UNITED REPUBLICAN PARTY,Tarbaj (ward),,4C4D1215-3669-E211-9497-005056870012,Mohamed Abdullahi Ahmed,,,http://info.mzalendo.com/person/mohamed-abdullahi-ahmed/,Forum For The Restoration Of Democracy - Kenya,Aspirant Senator at Wajir (County 2013-),,1134
Same,ASTARIKO INGATI OMBIMA,,Shirere (ward),,7D9EFB1A-9E6C-E211-A5C8-005056870012,Astariko Ingati Ombima,,,http://info.mzalendo.com/person/astariko-ingati-ombima/,,Aspirant Ward Representative at Shirere (Ward 2013-),,11170
Same,JOHN NDUNGU NGUGI,MZALENDO SABA SABA PARTY,Ngenda (ward),,1733CA9D-9F67-E211-8158-00505687000D,John Ndungu Ngugi,,,http://info.mzalendo.com/person/john-ndungu-ngugi/,Grand National Union,Aspirant Ward Representative at Kamahuha (Ward 2013-),,6021
Different,ALI MOHAMED,UNITED REPUBLICAN PARTY,Turbi (ward),,6C26599C-3569-E211-9497-005056870012,Ali Mohamed,,,http://info.mzalendo.com/person/ali-mohamed/,Wiper democratic Movement Kenya,Aspirant Ward Representative at Moyale Township (Ward 2013-),,9268
Same,FREDRICK NJOGU NJOROGE,THE NATIONAL ALLIANCE,Kawangware (ward),,6FB6BF6D-A067-E211-8158-00505687000D,Fredrick Njoroge,,,http://info.mzalendo.com/person/fredrick-njoroge/,Democratic Labour Party of Kenya,Aspirant Ward Representative at Kiuu (Ward 2013-),,7432
Same,MOHAMED ABDI FARAH,ORANGE DEMOCRATIC MOVEMENT,Dadaab (ward),,05630EFB-116A-E211-B91E-005056870012,Mohamed Abdi Farah,,,http://info.mzalendo.com/person/mohamed-abdi-farah/,United Republican Party (URP),Aspirant Ward Representative at Benane (Ward 2013-),,3443
Different,SAMUEL CHEGE KAMAU,UNITED DEMOCRATIC FORUM PARTY,Rware (ward),,4670111E-2A6C-E211-A5C8-005056870012,Samuel Kamau,,,http://info.mzalendo.com/person/samuel-kamau/,The National Alliance (TNA),Aspirant Ward Representative at Kiamaina (Ward 2013-),,6815
Same,ALI SALIM MWABATA,PEOPLES DEMOCRATIC PARTY,Kinondo (ward),,C20F4CC9-6A70-E211-A589-005056870012,Ali Salim Mwabata,,,http://info.mzalendo.com/person/ali-salim-mwabata/,People's Democratic Party (PDP),Aspirant MP at Msambweni (Constituency 2013-),,2389
Same (Post vying for is missing),CHARLES OKOTH OWINO,THE INDEPENDENT PARTY,Sarang'ombe (ward),,890A21DE-136A-E211-B91E-005056870012,Charles Oyugi Owino,,,http://info.mzalendo.com/person/charles-owino/,National Rainbow Coalition,,,332
Same,PETER MWANGI MAINA,THE NATIONAL ALLIANCE,Mukurwe - Ini West (ward),,47032D7D-9F67-E211-8158-00505687000D,Peter Mwangi Maina,,,http://info.mzalendo.com/person/peter-mwangi-maina/,The National Alliance (TNA),Aspirant Ward Representative at Central (Ward 2013-),,3999
Same,HENRY NYONGESA KHAEMBA,NEW FORD KENYA,Bumula (ward),,9FC557C2-916C-E211-A5C8-005056870012,Henry Nyongesa Khaemba,,,http://info.mzalendo.com/person/henry-nyongesa-khaemba/,National Agenda Party of Kenya,Aspirant Ward Representative at Bokoli (Ward 2013-),,3644
Same,HENRY KIBET BARNO,THE NATIONAL ALLIANCE,Tulwet / Chiyat (ward),,51E12981-7C69-E211-B91E-005056870012,Henry Kibet Barno,,,http://info.mzalendo.com/person/henry-kibet-barno/,The National Alliance (TNA),Aspirant Ward Representative at Tulwet / Chiyat (Ward 2013-),,11885
Same,SAMUEL CHEGE KAMAU,GRAND NATIONAL UNION,Mkunumbi (ward),,16271E29-CA6D-E211-A5C8-005056870012,Samuel Kamau,,,http://info.mzalendo.com/person/samuel-kamau/,The National Alliance (TNA),Aspirant Ward Representative at Kiamaina (Ward 2013-),,6815
Different,ALI MOHAMED,CHAMA CHA UZALENDO,Tononoka (ward),,C6D5C754-B567-E211-8158-00505687000D,Ali Mohamed,,,http://info.mzalendo.com/person/ali-mohamed/,Wiper democratic Movement Kenya,Aspirant Ward Representative at Moyale Township (Ward 2013-),,9268
Different,JOHN LANGAT,KENYA NATIONAL DEMOCRATIC ALLIANCE,Nyangores (ward),,5BF57425-126A-E211-B91E-005056870012,John Langat,,,http://info.mzalendo.com/person/john-langat/,Orange Democratic Movement,Aspirant Ward Representative at Kipchebor (Ward 2013-),,7161
Same,JULIUS MURIITHI WANJOHI,,Thegu River (ward),,73F3C7A0-956B-E211-A5C8-005056870012,Julius Muriithi Wanjohi,,,http://info.mzalendo.com/person/julius-muriithi-wanjohi/,,Aspirant Ward Representative at Thegu River (Ward 2013-),,11677
Same,JOSEPH NJOROGE MWANGI,ORANGE DEMOCRATIC MOVEMENT,Wangu (ward),,304E64D4-836C-E211-A5C8-005056870012,Joseph Njoroge Mwangi,,,http://info.mzalendo.com/person/joseph-njoroge-mwangi/,The National Alliance (TNA),Aspirant Ward Representative at Mbiri (Ward 2013-),,8839
Same,FIDELIS MUTHAMA SAMUEL,THE NATIONAL VISION PARTY,Mitaboni (ward),,68CD5679-7D6C-E211-A5C8-005056870012,Fidelis Muthama Samuel,,,http://info.mzalendo.com/person/fidelis-muthama-samuel/,The National Vision Party (NVP),Aspirant Ward Representative at Mitaboni (Ward 2013-),,9037
Same,JOSEPH KIPNGETICH KIRUI,UNITED REPUBLICAN PARTY,Mogondo (ward),,714D1215-3669-E211-9497-005056870012,Joseph Kirui,,,http://info.mzalendo.com/person/joseph-kirui/,United Democratic Forum Party (UDF),Aspirant Ward Representative at Nyangores (Ward 2013-),,10475
Same,WESLEY KIPKIRUI LANGAT,KENYA NATIONAL CONGRESS,Sogoo (ward),,FF597D19-8669-E211-B91E-005056870012,Wesley Kipkirui Langat,,,http://info.mzalendo.com/person/wesley-kipkirui-langat/,Wiper democratic Movement Kenya,Aspirant Ward Representative at Nyota (Ward 2013-),,10507
Same,MORRIS MUSILA MWANTHI,NATIONAL PARTY OF KENYA,Muthetheni (ward),,3E9E949E-5F6C-E211-A5C8-005056870012,Morris Musila Mwanthi,,,http://info.mzalendo.com/person/morris-musila-mwanthi/,National Party Of Kenya,Aspirant Ward Representative at Kibauni (Ward 2013-),,6867
Same,EVANS KIDERO,ORANGE DEMOCRATIC MOVEMENT,Nairobi (county),,779CBEA9-486C-E211-A5C8-005056870012,Evans Odhiambo Kidero,Evans Kidero,,http://info.mzalendo.com/person/evans-kidero/,Orange Democratic Movement,Aspirant Governor at Nairobi (County 2013-),,454
Different (safe guess),CHARLES ORIEDO OWINO,MKENYA SOLIDARITY MOVEMENT,Sarang'ombe (ward),,7369F915-D866-E211-A3B9-00505687000D,Charles Oyugi Owino,,,http://info.mzalendo.com/person/charles-owino/,National Rainbow Coalition,,,332
Same,PHILIP MALWA KISIA,FEDERAL PARTY OF KENYA,Nairobi (county),,99B7FD47-796C-E211-A5C8-005056870012,Philip Kisia,,,http://info.mzalendo.com/person/philip-kisia/,Federal Party of Kenya,Aspirant Governor at Nairobi (County 2013-),,466
